Date,Text
2020-01-30 23:34:37+00:00,"#Coronavirus: Stunning new numbers. Running totals - 9,171 confirmed cases worldwide vs 7,711 China cases yesterday; 213 deaths vs 130 yesterday. More than 12,000 suspected cases. 1,476 in serious or critical condition. ALL regions of China are reporting cases. h/t @V2019N"
2020-01-30 23:19:16+00:00,"- 9,171 confirmed #coronavirus cases worldwide - 12,167 suspected cases - 213 deaths - 1,476 in serious/critical condition - 150 treated and released - all regions of #China reporting cases - 23 territories reporting cases"
2020-01-30 22:58:45+00:00,@CDCgov CDC webinar for clinicians on #coronavirus #2019nCoV
2020-01-30 22:50:19+00:00,#coronavirus Preprint on effectiveness of traveler screening. 
2020-01-30 22:18:49+00:00,Wuhan Coronavirus Warnung an uns Menschen，Vielleicht können wir die Antwort aus dem Aufstieg und Fall des alten Römischen Reiches kennen，Dieses Video enthüllt die Geheimnisse für Sie im Detail. .
2020-01-30 22:11:34+00:00,"Update -#coronavirus cases confirmed now in 23 territories. -Italy confirmed 2 cases, Philippines (1), India (1) #2019nCoV -World Health Organization declares #PHEIC -over 8,000 cases in #China -#US State Department authorizes diplomatic staff to evacuate #China"
2020-01-30 20:10:38+00:00, What an absolute abomination of a press conference regarding #coronavirus #nCoV19! Not ONE question received straight answer. No clarification or leadership from the @WHO. The world deserves much more than this. #coronavirus #coronavirusec #China @V2019N
2020-01-30 19:54:29+00:00,"I’m just calling it coronavirus, rolls off the tongue easier"
2020-01-30 19:44:54+00:00,@WHO @DrTedros declares a #PHEIC #coronavirus Concern about virus spreading to countries with weaker health systems and who are not prepared to deal with it. WHO has confidence in China's capacity to control outbreak.
2020-01-30 19:04:38+00:00,"Messaging from #publichealth, scientists, physicians that the #coronavirus is not as dangerous as the flu (several stories this week) could erode public trust. There are many unknowns, no vaccine or antivirals approved for #coronavirus unlike flu."
2020-01-30 18:54:32+00:00,Another: People who are siloed in ID/public health seem to think the public is panicking about the news. But this messaging that the flu is worse than coronavirus could backfire. 
2020-01-30 18:42:24+00:00,Pas #coronavirus ou par??
2020-01-30 18:11:12+00:00,"Última atualização da China: Dados oficiais mostram agora 8.149 casos de #coronavirus confirmados no país, com 171 mortes. #2019nCoV @V2019N "
2020-01-30 17:56:37+00:00,thread on 6th #US confirmed coronavirus case 
2020-01-30 17:52:20+00:00,#HongKong 12 confirmed #coronavirus cases 
2020-01-30 17:50:15+00:00,"Chinese official data now shows 8,149 confirmed #coronavirus cases in the country with 171 deaths, according to state media outlets. #2019nCoV"
2020-01-30 17:42:00+00:00,#US confirmed #coronavirus cases now 6 including one case as a result of human-to-human (onward spread) in IL.
2020-01-30 17:40:41+00:00,Reuters: @CDCgov announces first instance of person-to-person #coronavirus spread inside #US. #2019nCoV
2020-01-30 17:32:07+00:00,Threads by scientists and doctors who can ELI5 #coronavirus information could help with misinformation.
2020-01-30 17:30:37+00:00,thread on mutation of the #coronavirus 
2020-01-30 17:04:05+00:00,simple #tweetorial from experts would be helpful on -#coronavirus and mutation -why get the flu shot/how bad flu can be/how this #coronavirus outbreak is different from flu -why travel bans don't work well to stop spread -why citizens should be repatriated from Wuhan/China
2020-01-30 16:51:56+00:00,"Most ""at risk"" cities for #coronavirus across the globe. Study from 1/28/20 https://www.southampton.ac.uk/news/2020/01/corona-virus.page #nCoV2019"
2020-01-30 16:40:33+00:00,thread #coronavirus asymptomatic/symptomatic etc. 
2020-01-30 16:26:32+00:00,"FROM 2018 The #US strategic stockpile. #coronavirus Officials won't say how many stockpile warehouses exist. But there are at least 6. All the locations are secret, including this one in an industrial complex off a busy highway. "
2020-01-30 16:22:52+00:00,Updated list of countries and numbers of #coronavirus cases. #nCoV2019 @Wikipedia https://en.wikipedia.org/wiki/2019%E2%80%9320_Wuhan_coronavirus_outbreak
2020-01-30 16:18:30+00:00,"""Cases recorded in Taiwan, Germany, Vietnam and Japan involved patients who had not been to China. There have been no reported deaths outside #China."" - @nytimes #nCoV2019 #coronavirus https://www.nytimes.com/2020/01/30/world/asia/coronavirus-china.html"
2020-01-30 16:11:45+00:00,"""The number of people diagnosed with a new #coronavirus infection in Australia increased to eight on the 30th, of which 4 were in New South Wales, 3 were in Victoria, and 1 was in Queensland."" #nCoV2019 http://www.kaixian.tv/gd/2020/0130/274646.html"
2020-01-30 16:03:18+00:00, Not good.. International flights must be halted in and out of China. @V2019N @British_Airways @WHO #coronavirus #coronavirusec #BritishAirways #nCoV2019
2020-01-30 15:29:24+00:00,Note: this Twitter account is apolitical. @RonaldKlain @ScottGottliebMD are excellent people to follow for an understanding of the intersection of politics and outbreaks in the #US and response of US gov't. #coronavirus 
2020-01-30 14:58:25+00:00,"""Human-to-human transmission likely occurred from near the beginning."" #coronavirus #nCoV2019"
2020-01-30 14:52:24+00:00,"""More than 6,000 people have been prevented from disembarking from a cruise ship in the Italian port city of Civitavecchia after the liner was placed on lockdown over two suspected cases of the deadly #coronavirus."" "
2020-01-30 14:24:35+00:00," First confirmed case out of Kerala, India #coronavirus #coronavirusec #India #nCoV2019 Let's hope this is contained in Kerala.. Seems unlikely at this point. @who @V2019N India confirms its first coronavirus case "
2020-01-30 14:15:05+00:00,"It is not sars - sars is from the family of coronaviruses, as is mers. The novella Coronavirus is also of the same family. Sars, novella Coronavirus (what we have now) and mers are similar but not the same. NC is more contagious than sars and mers."
2020-01-30 14:14:32+00:00,"My point was not worth pissing you off. SARS Is caused by coronavirus. I am conflating the two, like lopping HIV and AIDS into the same basket. I'm sorry that I scuffed your thickest of skin. My bad."
2020-01-30 13:38:35+00:00,I have heard on the radio that UK pandemic contingency plans include converting school gyms/stadiums/swimming pools into field hospitals. So why are Chinese building new hospitals? Doesn't make sense #nCoV19 #coronavirus @howroute @V2019N
2020-01-30 10:23:22+00:00,India reports its first confirmed #coronavirus positive case. A student returning #Kerala from #Wuhan University is currently stable and being monitored. @V2019N #CoronavirusWHO #nCoV2019 @JHUSystems
2020-01-30 08:54:21+00:00,Shortly | One Positive Case Is Reported of Coronavirus In Kerala: Union Health Ministry https://thehealth.today/one-positive-case-is-reported-of-coronavirus-in-kerala-union-health-ministry/ @V2019N @WHO @WHOSEARO #coronavirus #CoronavirusWho #coronavirusindia #CoronaOutbreak #nCoV2020 #nCoV2019 #nCoV #WuhanCoronavirus #WuhanPneumonia #WuhanOutbreak
2020-01-30 05:49:00+00:00,"No, this is a novel corona virus, sars happened in 2003 - they are from the same family as is mers. This is worse than sars."
2020-01-30 05:26:16+00:00,It actually is SARS.... As SARS is coronavirus.
2020-01-30 04:38:08+00:00,"#UK FCO -advise against all travel to Hubei Province. If you're in this area &amp; able to leave, you should do so. -advise against all but essential travel to the rest of mainland China due to ongoing novel #coronavirus outbreak. You may want to leave soon https://promedmail.org/promed-post/?id=20200129.6929532"
2020-01-30 03:54:41+00:00,"In Canada, it's Chief Public Health Officer is dealing with a mutation of #coronavirus, rampant and out of control anti-Chinese and anti-Asian racism across Canada "
2020-01-30 03:39:51+00:00,"Q: How should clinicians handle? A: CDC guide if they come into contact. If someone comes in & presents w/ respiratory involvement & fever, ask ""Have you been in #China recently?"" If yes, mask on them, isolation room, contact @CDCgov -Fauci #coronavirus "
2020-01-30 03:11:24+00:00,"Can infected people can start spreading the virus before they themselves get sick? Chinese health officials said they believe such transmission has taken place. If it happened often, could make stopping an outbreak much harder."" #coronavirus https://www.nytimes.com/2020/01/29/health/china-coronavirus-outbreak.html?smid=tw-nythealth&amp;smtyp=cur"
2020-01-30 03:05:46+00:00,"@CDCgov is already gearing up should the approach need to evolve to mitigation strategies like closing schools, preventing public gatherings and helping hospitals prepare for a surge of cases. #coronavirus #2019nCoV https://www.nytimes.com/2020/01/29/health/china-coronavirus-outbreak.html?smid=tw-nythealth&amp;smtyp=cur"
2020-01-30 03:02:48+00:00,"“I think the next four to five weeks are going to be critical. It’s either going to start peaking and go into a downturn, or it’s going to explode into a global outbreak.” - Fauci NIAID #coronavirus #2019nCoV"
2020-01-30 03:00:43+00:00,"“If we’re seeing widespread transmission, I don’t see how this gets controlled. On the other hand, if we see a ... incredible effort they were able to isolate people, tamp down the spread, then we’re in a containment situation.” -Frieden #coronavirus https://www.nytimes.com/2020/01/29/health/china-coronavirus-outbreak.html?smid=tw-nythealth&amp;smtyp=cur"
2020-01-30 01:52:06+00:00,I hate to say this but what do you expect from the #Trump administration everything #POTUS touches dies. #CDC is a joke. #CoronavirusOutbreak #coronavirususa #coronavirus
2020-01-30 01:10:17+00:00,3 #Japanese evacuees test positive for #coronavirus | NHK WORLD-JAPAN News https://www3.nhk.or.jp/nhkworld/en/news/20200130_26/
2020-01-30 00:56:32+00:00,"thread on #CoronavirusOutbreak best case / worst case, interventions etc. #coronaravirus #coronavirus #China"
2020-01-30 00:39:37+00:00,Great piece on past #pandemics and #coronavirus. 
